{
  "schema": "skenion.graph",
  "schemaVersion": "0.1.0",
  "id": "help-core-bool",
  "revision": "1",
  "nodes": [
    {
      "id": "note_1",
      "kind": "core.comment",
      "kindVersion": "0.1.0",
      "params": {
        "text": "Bool re-emits its stored boolean on bang. It does not flip state."
      },
      "ports": []
    },
    {
      "id": "bang_1",
      "kindVersion": "0.1.0",
      "params": {},
      "ports": [
        {
          "id": "in",
          "direction": "input",
          "label": "In",
          "type": "message.any",
          "required": false
        },
        {
          "id": "out",
          "direction": "output",
          "label": "Bang",
          "type": "event.bang"
        }
      ],
      "kind": "core.bang"
    },
    {
      "id": "value_1",
      "kind": "core.bool",
      "kindVersion": "0.1.0",
      "params": {
        "value": true
      },
      "ports": [
        {
          "id": "in",
          "direction": "input",
          "label": "In",
          "type": "message.any",
          "required": false
        },
        {
          "id": "cold",
          "direction": "input",
          "label": "Cold",
          "type": "boolean",
          "required": false
        },
        {
          "id": "value",
          "direction": "output",
          "label": "Value",
          "type": "boolean"
        }
      ]
    },
    {
      "id": "toggle_1",
      "kindVersion": "0.1.0",
      "params": {
        "value": false,
        "widget": "toggle"
      },
      "ports": [
        {
          "id": "in",
          "direction": "input",
          "label": "In",
          "type": "message.any",
          "required": false
        },
        {
          "id": "cold",
          "direction": "input",
          "label": "Cold",
          "type": "boolean",
          "required": false
        },
        {
          "id": "value",
          "direction": "output",
          "label": "Value",
          "type": "boolean"
        }
      ],
      "kind": "core.bool"
    }
  ],
  "edges": [
    {
      "id": "edge-1",
      "source": {
        "nodeId": "bang_1",
        "portId": "out"
      },
      "target": {
        "nodeId": "value_1",
        "portId": "in"
      }
    },
    {
      "id": "edge-2",
      "source": {
        "nodeId": "value_1",
        "portId": "value"
      },
      "target": {
        "nodeId": "toggle_1",
        "portId": "cold"
      }
    }
  ]
}
