{
  "schema": "skenion.graph",
  "schemaVersion": "0.1.0",
  "id": "help-core-message",
  "revision": "1",
  "nodes": [
    {
      "id": "note_1",
      "kind": "core.comment",
      "kindVersion": "0.1.0",
      "params": {
        "text": "Message emits its saved text when clicked, banged, or triggered. set updates the runtime message silently."
      },
      "ports": []
    },
    {
      "id": "bang_1",
      "kindVersion": "0.1.0",
      "params": {},
      "ports": [
        {
          "id": "in",
          "direction": "input",
          "label": "In",
          "type": "message.any",
          "required": false
        },
        {
          "id": "out",
          "direction": "output",
          "label": "Bang",
          "type": "event.bang"
        }
      ],
      "kind": "core.bang"
    },
    {
      "id": "message_1",
      "kind": "core.message",
      "kindVersion": "0.1.0",
      "params": {
        "value": "render now"
      },
      "ports": [
        {
          "id": "in",
          "direction": "input",
          "label": "In",
          "type": "message.any",
          "required": false
        },
        {
          "id": "out",
          "direction": "output",
          "label": "Message",
          "type": "message.any"
        }
      ]
    }
  ],
  "edges": [
    {
      "id": "edge-1",
      "source": {
        "nodeId": "bang_1",
        "portId": "out"
      },
      "target": {
        "nodeId": "message_1",
        "portId": "in"
      }
    }
  ]
}
