{
  "schema": "skenion.graph",
  "schemaVersion": "0.1.0",
  "id": "help-render-fullscreen-shader",
  "revision": "1",
  "nodes": [
    {
      "id": "speed_1",
      "kind": "core.float",
      "kindVersion": "0.1.0",
      "params": {
        "value": 0.35,
        "representation": "f32"
      },
      "ports": [
        {
          "id": "in",
          "direction": "input",
          "label": "In",
          "type": "message.any",
          "required": false
        },
        {
          "id": "cold",
          "direction": "input",
          "label": "Cold",
          "type": "number.float",
          "required": false
        },
        {
          "id": "value",
          "direction": "output",
          "label": "Value",
          "type": "number.float"
        }
      ]
    },
    {
      "id": "tint_1",
      "kind": "core.color",
      "kindVersion": "0.1.0",
      "params": {
        "value": [
          0.2,
          0.6,
          1,
          1
        ],
        "representation": "rgba32f",
        "colorSpace": "linear"
      },
      "ports": [
        {
          "id": "in",
          "direction": "input",
          "label": "In",
          "type": "message.any",
          "required": false
        },
        {
          "id": "cold",
          "direction": "input",
          "label": "Cold",
          "type": "color",
          "required": false
        },
        {
          "id": "value",
          "direction": "output",
          "label": "Color",
          "type": "color"
        }
      ]
    },
    {
      "id": "shader_1",
      "kind": "render.fullscreen-shader",
      "kindVersion": "0.1.0",
      "params": {
        "language": "wgsl",
        "source": "// @skenion.uniform speed number.float default=0.35\n// @skenion.uniform tint color default=[0.2,0.6,1,1]\nfn fs_main() -> @location(0) vec4<f32> { return skenion_uniforms.tint * skenion_uniforms.speed; }"
      },
      "ports": [
        {
          "id": "speed",
          "direction": "input",
          "label": "Speed",
          "type": "number.float"
        },
        {
          "id": "tint",
          "direction": "input",
          "label": "Tint",
          "type": "color"
        },
        {
          "id": "out",
          "direction": "output",
          "label": "Out",
          "type": "gpu.texture2d"
        }
      ]
    },
    {
      "id": "output_1",
      "kind": "render.output",
      "kindVersion": "0.1.0",
      "params": {},
      "ports": [
        {
          "id": "in",
          "direction": "input",
          "label": "In",
          "type": "gpu.texture2d"
        }
      ]
    }
  ],
  "edges": [
    {
      "id": "edge-1",
      "source": {
        "nodeId": "speed_1",
        "portId": "value"
      },
      "target": {
        "nodeId": "shader_1",
        "portId": "speed"
      }
    },
    {
      "id": "edge-2",
      "source": {
        "nodeId": "tint_1",
        "portId": "value"
      },
      "target": {
        "nodeId": "shader_1",
        "portId": "tint"
      }
    },
    {
      "id": "edge-3",
      "source": {
        "nodeId": "shader_1",
        "portId": "out"
      },
      "target": {
        "nodeId": "output_1",
        "portId": "in"
      }
    }
  ]
}
