{
  "schema": "skenion.graph",
  "schemaVersion": "0.1.0",
  "id": "help-object-core-clock-local",
  "revision": "1",
  "nodes": [
    {
      "id": "clock_1",
      "kind": "object.core.clock.local",
      "kindVersion": "0.1.0",
      "params": {
        "tempoBpm": 120,
        "running": true
      },
      "ports": [
        {
          "id": "sync",
          "direction": "input",
          "label": "Sync",
          "type": "clock.state",
          "required": false
        },
        {
          "id": "reset",
          "direction": "input",
          "label": "Reset",
          "type": "value.core.bang",
          "required": false
        },
        {
          "id": "state",
          "direction": "output",
          "label": "State",
          "type": "clock.state"
        },
        {
          "id": "tick",
          "direction": "output",
          "label": "Tick",
          "type": "value.core.bang"
        },
        {
          "id": "phase",
          "direction": "output",
          "label": "Phase",
          "type": "value.core.float64"
        },
        {
          "id": "tempo",
          "direction": "output",
          "label": "Tempo",
          "type": "value.core.float64"
        }
      ]
    },
    {
      "id": "display_1",
      "kind": "object.core.clock.position-display",
      "kindVersion": "0.1.0",
      "params": {},
      "ports": [
        {
          "id": "clock",
          "direction": "input",
          "label": "Clock",
          "type": "clock.state",
          "required": false
        }
      ]
    }
  ],
  "edges": [
    {
      "id": "edge-1",
      "source": {
        "nodeId": "clock_1",
        "portId": "state"
      },
      "target": {
        "nodeId": "display_1",
        "portId": "clock"
      }
    }
  ]
}
