{
  "schema": "skenion.graph",
  "schemaVersion": "0.1.0",
  "id": "help-core-color",
  "revision": "1",
  "nodes": [
    {
      "id": "note_1",
      "kind": "core.comment",
      "kindVersion": "0.1.0",
      "params": {
        "text": "RGBA controls shader tint uniforms with normalized components."
      },
      "ports": []
    },
    {
      "id": "tint_1",
      "kind": "core.color",
      "kindVersion": "0.1.0",
      "params": {
        "value": [
          1,
          0.2,
          0.1,
          1
        ],
        "representation": "rgba32f",
        "colorSpace": "linear"
      },
      "ports": [
        {
          "id": "in",
          "direction": "input",
          "label": "In",
          "type": "message.any",
          "required": false
        },
        {
          "id": "cold",
          "direction": "input",
          "label": "Cold",
          "type": "color",
          "required": false
        },
        {
          "id": "value",
          "direction": "output",
          "label": "Color",
          "type": "color"
        }
      ]
    },
    {
      "id": "shader_1",
      "kind": "render.fullscreen-shader",
      "kindVersion": "0.1.0",
      "params": {
        "language": "wgsl",
        "source": "// @skenion.uniform tint color default=[1,0.2,0.1,1]\nfn fs_main() -> @location(0) vec4<f32> { return skenion_uniforms.tint; }"
      },
      "ports": [
        {
          "id": "tint",
          "direction": "input",
          "label": "Tint",
          "type": "color"
        },
        {
          "id": "out",
          "direction": "output",
          "label": "Out",
          "type": "gpu.texture2d"
        }
      ]
    },
    {
      "id": "output_1",
      "kind": "render.output",
      "kindVersion": "0.1.0",
      "params": {},
      "ports": [
        {
          "id": "in",
          "direction": "input",
          "label": "In",
          "type": "gpu.texture2d"
        }
      ]
    }
  ],
  "edges": [
    {
      "id": "edge-1",
      "source": {
        "nodeId": "tint_1",
        "portId": "value"
      },
      "target": {
        "nodeId": "shader_1",
        "portId": "tint"
      }
    },
    {
      "id": "edge-2",
      "source": {
        "nodeId": "shader_1",
        "portId": "out"
      },
      "target": {
        "nodeId": "output_1",
        "portId": "in"
      }
    }
  ]
}
