{
  "schema": "skenion.graph",
  "schemaVersion": "0.1.0",
  "id": "help-core-float",
  "revision": "1",
  "nodes": [
    {
      "id": "note_1",
      "kind": "core.comment",
      "kindVersion": "0.1.0",
      "params": {
        "text": "F32 stores a number. in emits, set stores silently, bang emits the current value."
      },
      "ports": []
    },
    {
      "id": "bang_1",
      "kindVersion": "0.1.0",
      "params": {},
      "ports": [
        {
          "id": "in",
          "direction": "input",
          "label": "In",
          "type": "message.any",
          "required": false
        },
        {
          "id": "out",
          "direction": "output",
          "label": "Bang",
          "type": "event.bang"
        }
      ],
      "kind": "core.bang"
    },
    {
      "id": "value_1",
      "kind": "core.float",
      "kindVersion": "0.1.0",
      "params": {
        "value": 0.5,
        "representation": "f32"
      },
      "ports": [
        {
          "id": "in",
          "direction": "input",
          "label": "In",
          "type": "message.any",
          "required": false
        },
        {
          "id": "cold",
          "direction": "input",
          "label": "Cold",
          "type": "number.float",
          "required": false
        },
        {
          "id": "value",
          "direction": "output",
          "label": "Value",
          "type": "number.float"
        }
      ]
    },
    {
      "id": "target_1",
      "kindVersion": "0.1.0",
      "params": {},
      "ports": [
        {
          "id": "in",
          "direction": "input",
          "label": "In",
          "type": "message.any",
          "required": false
        },
        {
          "id": "cold",
          "direction": "input",
          "label": "Cold",
          "type": "number.float",
          "required": false
        },
        {
          "id": "value",
          "direction": "output",
          "label": "Value",
          "type": "number.float"
        }
      ],
      "kind": "core.float"
    }
  ],
  "edges": [
    {
      "id": "edge-1",
      "source": {
        "nodeId": "bang_1",
        "portId": "out"
      },
      "target": {
        "nodeId": "value_1",
        "portId": "in"
      }
    },
    {
      "id": "edge-2",
      "source": {
        "nodeId": "value_1",
        "portId": "value"
      },
      "target": {
        "nodeId": "target_1",
        "portId": "in"
      }
    }
  ]
}
