{
  "schema": "skenion.graph",
  "schemaVersion": "0.1.0",
  "id": "help-core-video-decode",
  "revision": "1",
  "nodes": [
    {
      "id": "asset_1",
      "kind": "core.video-asset",
      "kindVersion": "0.1.0",
      "params": {
        "src": "example.mp4"
      },
      "ports": [
        {
          "id": "asset",
          "direction": "output",
          "label": "Asset",
          "type": "asset.video"
        }
      ]
    },
    {
      "id": "decode_1",
      "kind": "core.video-decode",
      "kindVersion": "0.1.0",
      "params": {},
      "ports": [
        {
          "id": "asset",
          "direction": "input",
          "label": "Asset",
          "type": "asset.video"
        },
        {
          "id": "frames",
          "direction": "output",
          "label": "Frames",
          "type": "video.frame"
        }
      ]
    },
    {
      "id": "upload_1",
      "kind": "core.gpu-upload",
      "kindVersion": "0.1.0",
      "params": {},
      "ports": [
        {
          "id": "frames",
          "direction": "input",
          "label": "Frames",
          "type": "video.frame"
        }
      ]
    }
  ],
  "edges": [
    {
      "id": "edge-1",
      "source": {
        "nodeId": "asset_1",
        "portId": "asset"
      },
      "target": {
        "nodeId": "decode_1",
        "portId": "asset"
      }
    },
    {
      "id": "edge-2",
      "source": {
        "nodeId": "decode_1",
        "portId": "frames"
      },
      "target": {
        "nodeId": "upload_1",
        "portId": "frames"
      }
    }
  ]
}
