{
  "schema": "skenion.graph",
  "schemaVersion": "0.1.0",
  "id": "help-clock-position-display",
  "revision": "1",
  "nodes": [
    {
      "id": "clock_1",
      "kind": "clock.local",
      "kindVersion": "0.1.0",
      "params": {
        "tempoBpm": 120,
        "running": true
      },
      "ports": [
        {
          "id": "state",
          "direction": "output",
          "label": "State",
          "type": "clock.state"
        }
      ]
    },
    {
      "id": "display_1",
      "kind": "clock.position-display",
      "kindVersion": "0.1.0",
      "params": {
        "fields": [
          "bar",
          "beat",
          "division",
          "tick",
          "timecode"
        ]
      },
      "ports": [
        {
          "id": "clock",
          "direction": "input",
          "label": "Clock",
          "type": "clock.state",
          "required": false
        }
      ]
    }
  ],
  "edges": [
    {
      "id": "edge-1",
      "source": {
        "nodeId": "clock_1",
        "portId": "state"
      },
      "target": {
        "nodeId": "display_1",
        "portId": "clock"
      }
    }
  ]
}
