{
  "schema": "skenion.graph",
  "schemaVersion": "0.1.0",
  "id": "help-core-unresolved-object",
  "revision": "1",
  "nodes": [
    {
      "id": "note_1",
      "kind": "core.comment",
      "kindVersion": "0.1.0",
      "params": {
        "text": "Unresolved Object preserves object text that could not resolve, reports a Runtime diagnostic, and stays editable on the canvas."
      },
      "ports": []
    },
    {
      "id": "unresolved_1",
      "kind": "core.unresolved-object",
      "kindVersion": "0.1.0",
      "params": {
        "objectText": "user.manipulator",
        "diagnosticMessage": "extension object is not installed",
        "requestedKind": "user.manipulator"
      },
      "ports": []
    }
  ],
  "edges": []
}
