{
  "schema": "skenion.graph",
  "schemaVersion": "0.1.0",
  "id": "help-core-string",
  "revision": "1",
  "nodes": [
    {
      "id": "note_1",
      "kind": "core.comment",
      "kindVersion": "0.1.0",
      "params": {
        "text": "String stores text as graph data. Message emits text only when triggered."
      },
      "ports": []
    },
    {
      "id": "bang_1",
      "kindVersion": "0.1.0",
      "params": {},
      "ports": [
        {
          "id": "in",
          "direction": "input",
          "label": "In",
          "type": "message.any",
          "required": false
        },
        {
          "id": "out",
          "direction": "output",
          "label": "Bang",
          "type": "event.bang"
        }
      ],
      "kind": "core.bang"
    },
    {
      "id": "text_1",
      "kind": "core.string",
      "kindVersion": "0.1.0",
      "params": {
        "value": "hello"
      },
      "ports": [
        {
          "id": "in",
          "direction": "input",
          "label": "In",
          "type": "message.any",
          "required": false
        },
        {
          "id": "cold",
          "direction": "input",
          "label": "Cold",
          "type": "string",
          "required": false
        },
        {
          "id": "value",
          "direction": "output",
          "label": "Value",
          "type": "string"
        }
      ]
    }
  ],
  "edges": [
    {
      "id": "edge-1",
      "source": {
        "nodeId": "bang_1",
        "portId": "out"
      },
      "target": {
        "nodeId": "text_1",
        "portId": "in"
      }
    }
  ]
}
