{
  "schema": "skenion.graph",
  "schemaVersion": "0.1.0",
  "id": "ordered-event-fan-in",
  "revision": "1",
  "nodes": [
    {
      "id": "button_a",
      "kindVersion": "0.1.0",
      "params": {},
      "ports": [
        {
          "id": "out",
          "direction": "output",
          "type": "event.bang",
          "rate": "event"
        }
      ],
      "kind": "core.bang"
    },
    {
      "id": "button_b",
      "kindVersion": "0.1.0",
      "params": {},
      "ports": [
        {
          "id": "out",
          "direction": "output",
          "type": "event.bang",
          "rate": "event"
        }
      ],
      "kind": "core.bang"
    },
    {
      "id": "event_log",
      "kindVersion": "0.1.0",
      "params": {},
      "ports": [
        {
          "id": "in",
          "direction": "input",
          "type": "event.bang",
          "rate": "event",
          "maxConnections": 2,
          "mergePolicy": "ordered-events",
          "triggerMode": "trigger"
        }
      ],
      "kind": "core.message"
    }
  ],
  "edges": [
    {
      "id": "edge_button_a_log",
      "source": {
        "nodeId": "button_a",
        "portId": "out"
      },
      "target": {
        "nodeId": "event_log",
        "portId": "in"
      },
      "resolvedType": "event.bang",
      "order": 0
    },
    {
      "id": "edge_button_b_log",
      "source": {
        "nodeId": "button_b",
        "portId": "out"
      },
      "target": {
        "nodeId": "event_log",
        "portId": "in"
      },
      "resolvedType": "event.bang",
      "order": 1
    }
  ]
}
